{
  "meta": {
    "title": "长沙 7天6晚旅行计划",
    "subtitle": "2026/04/01 - 2026/04/07｜探索长沙",
    "description": "长沙 7天行程规划，包含主要景点和交通安排。"
  },
  "hero": {
    "title": "长沙 7天6晚旅行计划",
    "subtitle": "探索长沙的精彩旅程",
    "dateRange": "2026/04/01 - 2026/04/07",
    "tags": [
      "长沙",
      "7天6晚",
      "岳麓山",
      "橘子洲"
    ],
    "summary": "这是一份长沙 7天的旅行计划，涵盖主要景点和实用建议。",
    "heroImage": ""
  },
  "stats": [
    {
      "label": "出发",
      "value": "出发地 → 长沙"
    },
    {
      "label": "返程",
      "value": "Day 7 下午"
    },
    {
      "label": "时长",
      "value": "7 天"
    },
    {
      "label": "酒店",
      "value": "五一广场"
    },
    {
      "label": "预算",
      "value": "约 ¥5000/人"
    }
  ],
  "hotels": [
    {
      "phase": "全程",
      "name": "五一广场精选酒店",
      "dateRange": "2026/04/01 - 2026/04/07",
      "station": "五一广场",
      "status": "推荐",
      "price": "约300元/晚",
      "distanceToMetro": "地铁方便",
      "image": "https://images.unsplash.com/photo-1566073771259-6a8506099945?auto=format&fit=crop&w=1200&q=80",
      "highlights": [
        "地铁1/2号线换乘站",
        "步行至太平街5分钟",
        "周边美食密集",
        "交通枢纽"
      ]
    }
  ],
  "metroCoverage": {
    "goal": "覆盖主要地铁线路，方便出行",
    "lines": [
      {
        "name": "1号线",
        "day": "Day 1",
        "status": "planned"
      },
      {
        "name": "S2线",
        "day": "Day 2",
        "status": "planned"
      },
      {
        "name": "2号线",
        "day": "Day 3",
        "status": "planned"
      },
      {
        "name": "3号线",
        "day": "Day 4",
        "status": "planned"
      },
      {
        "name": "4号线",
        "day": "Day 5",
        "status": "planned"
      }
    ]
  },
  "days": [
    {
      "day": "Day 1",
      "date": "04/01",
      "theme": "长沙探索日",
      "city": "长沙",
      "hotel": "五一广场精选酒店",
      "attractions": [
        {
          "name": "岳麓山",
          "city": "长沙",
          "type": "景点",
          "image": "https://images.unsplash.com/photo-1506905925346-21bda4d32df4?auto=format&fit=crop&w=1200&q=80",
          "description": "岳麓山索道票价：上行30元，下行25元，往返50元。开放时间：上午9:00-17:00。购票需提前预约。",
          "bestFor": [
            "观光",
            "拍照"
          ]
        },
        {
          "name": "橘子洲",
          "city": "长沙",
          "type": "景点",
          "image": "https://images.unsplash.com/photo-1506905925346-21bda4d32df4?auto=format&fit=crop&w=1200&q=80",
          "description": "长沙橘子洲一日游攻略：门票与费用 景区门票：橘子洲景区门票免费。 沙滩公园门票：50元/人。 观光车费用： 环全洲线：40元/人。 游船码头专线/沙滩公园专线：20元/人。 停车费用：小型车辆5元/次，大型车辆10元/次。",
          "bestFor": [
            "观光",
            "拍照"
          ]
        }
      ],
      "metroLines": [],
      "segments": {
        "morning": [
          "抵达长沙，入住酒店",
          "游览岳麓山"
        ],
        "afternoon": [
          "游览橘子洲"
        ],
        "evening": [
          "晚餐及自由活动"
        ]
      },
      "note": "根据实际行程调整"
    },
    {
      "day": "Day 2",
      "date": "04/02",
      "theme": "长沙探索日",
      "city": "长沙",
      "hotel": "五一广场精选酒店",
      "attractions": [
        {
          "name": "天心阁",
          "city": "长沙",
          "type": "景点",
          "image": "https://images.unsplash.com/photo-1506905925346-21bda4d32df4?auto=format&fit=crop&w=1200&q=80",
          "description": "[]( []( []( [](\n\n赏花发票抽奖赏银杏春节全攻略赏红叶攻略五一旅游攻略教师节国庆旅游攻略考研除夕活动指南赏梅花个人养老金观日出攻略亲子游展会露营房贷利率婴幼儿照护电动车上牌中考一分一段表端午节养老金领取清明节云招聘免费景点人口。",
          "bestFor": [
            "观光",
            "拍照"
          ]
        },
        {
          "name": "太平街",
          "city": "长沙",
          "type": "景点",
          "image": "https://images.unsplash.com/photo-1506905925346-21bda4d32df4?auto=format&fit=crop&w=1200&q=80",
          "description": "【导语】：长沙太平老街全天免费开放，想要去逛吃逛吃的朋友可以直接出发啦！她长沙城区中部，具体游玩攻略见正文。",
          "bestFor": [
            "观光",
            "拍照"
          ]
        }
      ],
      "metroLines": [],
      "segments": {
        "morning": [
          "游览天心阁"
        ],
        "afternoon": [
          "游览太平街"
        ],
        "evening": [
          "晚餐及自由活动"
        ]
      },
      "note": "根据实际行程调整"
    },
    {
      "day": "Day 3",
      "date": "04/03",
      "theme": "长沙探索日",
      "city": "长沙",
      "hotel": "五一广场精选酒店",
      "attractions": [
        {
          "name": "湖南省博物馆",
          "city": "长沙",
          "type": "景点",
          "image": "https://images.unsplash.com/photo-1506905925346-21bda4d32df4?auto=format&fit=crop&w=1200&q=80",
          "description": "# 湖南省博物馆开放时间+入馆须知（最新）\n\n导语 湖南省博物馆开放时间2025年7月1日至8月31日，每周二至周日开放时间延长至20：30（20:00停止入馆），每周一为闭馆日（逢法定节假日顺延）。",
          "bestFor": [
            "观光",
            "拍照"
          ]
        },
        {
          "name": "湖南第一师范",
          "city": "长沙",
          "type": "景点",
          "image": "https://images.unsplash.com/photo-1506905925346-21bda4d32df4?auto=format&fit=crop&w=1200&q=80",
          "description": "长沙湖南第一师范全天开放，无需门票。毛泽东与第一师范纪念馆暂停營業，具体时间未定。",
          "bestFor": [
            "观光",
            "拍照"
          ]
        }
      ],
      "metroLines": [],
      "segments": {
        "morning": [
          "游览湖南省博物馆"
        ],
        "afternoon": [
          "游览湖南第一师范"
        ],
        "evening": [
          "晚餐及自由活动"
        ]
      },
      "note": "根据实际行程调整"
    },
    {
      "day": "Day 4",
      "date": "04/04",
      "theme": "长沙探索日",
      "city": "长沙",
      "hotel": "五一广场精选酒店",
      "attractions": [
        {
          "name": "黄兴南路步行街",
          "city": "长沙",
          "type": "景点",
          "image": "https://images.unsplash.com/photo-1506905925346-21bda4d32df4?auto=format&fit=crop&w=1200&q=80",
          "description": "长沙黄兴南路步行街开放全天，无门票。推荐晚上前往，琳琅满目的商店。",
          "bestFor": [
            "观光",
            "拍照"
          ]
        }
      ],
      "metroLines": [],
      "segments": {
        "morning": [
          "前往黄兴南路步行街"
        ],
        "afternoon": [
          "深度游览黄兴南路步行街"
        ],
        "evening": [
          "晚餐及自由活动"
        ]
      },
      "note": "根据实际行程调整"
    },
    {
      "day": "Day 5",
      "date": "04/05",
      "theme": "长沙探索日",
      "city": "长沙",
      "hotel": "五一广场精选酒店",
      "attractions": [
        {
          "name": "杜甫江阁",
          "city": "长沙",
          "type": "景点",
          "image": "https://images.unsplash.com/photo-1506905925346-21bda4d32df4?auto=format&fit=crop&w=1200&q=80",
          "description": "他的脚步也引得广大诗迷们追随\n\n作为杜甫人生最后居住的地方“江阁”\n\n成为每位来长沙旅游的游客必打卡的景点之一\n\n作为湖南最大的仿唐木质结构建筑的杜甫江阁\n\n正随着年轻人的打卡焕发出新活力\n\n微信图片_20240719154350.jpg\n。",
          "bestFor": [
            "观光",
            "拍照"
          ]
        }
      ],
      "metroLines": [],
      "segments": {
        "morning": [
          "前往杜甫江阁"
        ],
        "afternoon": [
          "深度游览杜甫江阁"
        ],
        "evening": [
          "晚餐及自由活动"
        ]
      },
      "note": "根据实际行程调整"
    },
    {
      "day": "Day 6",
      "date": "04/06",
      "theme": "长沙探索日",
      "city": "长沙",
      "hotel": "五一广场精选酒店",
      "attractions": [
        {
          "name": "火宫殿",
          "city": "长沙",
          "type": "景点",
          "image": "https://images.unsplash.com/photo-1506905925346-21bda4d32df4?auto=format&fit=crop&w=1200&q=80",
          "description": "凡参赛选手，组委会免费赠送1张百年老店“火宫殿”9折券！凡参赛选手在长马官网预订酒店，组委会免费赠送1张百年老店“火宫殿”9折券+1张长沙臭豆腐美食券！【到店凭券即免费赠送火宫殿臭豆腐1份】领取指南\n\n- 上一篇文章：谢子龙影像艺术馆当代摄。",
          "bestFor": [
            "观光",
            "拍照"
          ]
        }
      ],
      "metroLines": [],
      "segments": {
        "morning": [
          "前往火宫殿"
        ],
        "afternoon": [
          "深度游览火宫殿"
        ],
        "evening": [
          "晚餐及自由活动"
        ]
      },
      "note": "根据实际行程调整"
    },
    {
      "day": "Day 7",
      "date": "04/07",
      "theme": "返程日",
      "city": "长沙",
      "hotel": null,
      "attractions": [
        {
          "name": "IFS国金中心",
          "city": "长沙",
          "type": "景点",
          "image": "https://images.unsplash.com/photo-1506905925346-21bda4d32df4?auto=format&fit=crop&w=1200&q=80",
          "description": "Changsha IFS国金中心营业时间10:00-22:00，门票免费，93层观景台最佳。",
          "bestFor": [
            "观光",
            "拍照"
          ]
        }
      ],
      "metroLines": [],
      "segments": {
        "morning": [
          "退房，前往IFS国金中心"
        ],
        "afternoon": [
          "返程"
        ],
        "evening": []
      },
      "note": "根据实际行程调整"
    }
  ],
  "sideTrips": [
    {
      "name": "湘潭",
      "date": "1天",
      "role": "周边侧游",
      "description": "毛泽东故居韶山；湘潭老城",
      "image": ""
    },
    {
      "name": "株洲",
      "date": "半天",
      "role": "周边侧游",
      "description": "株洲方特欢乐世界",
      "image": ""
    },
    {
      "name": "岳阳",
      "date": "1天",
      "role": "周边侧游",
      "description": "岳阳楼；洞庭湖；君山岛",
      "image": ""
    }
  ],
  "attractions": [
    {
      "name": "岳麓山",
      "city": "长沙",
      "type": "景点",
      "image": "https://images.unsplash.com/photo-1506905925346-21bda4d32df4?auto=format&fit=crop&w=1200&q=80",
      "description": "岳麓山索道票价：上行30元，下行25元，往返50元。开放时间：上午9:00-17:00。购票需提前预约。",
      "bestFor": [
        "观光",
        "拍照"
      ]
    },
    {
      "name": "橘子洲",
      "city": "长沙",
      "type": "景点",
      "image": "https://images.unsplash.com/photo-1506905925346-21bda4d32df4?auto=format&fit=crop&w=1200&q=80",
      "description": "长沙橘子洲一日游攻略：门票与费用 景区门票：橘子洲景区门票免费。 沙滩公园门票：50元/人。 观光车费用： 环全洲线：40元/人。 游船码头专线/沙滩公园专线：20元/人。 停车费用：小型车辆5元/次，大型车辆10元/次。",
      "bestFor": [
        "观光",
        "拍照"
      ]
    },
    {
      "name": "天心阁",
      "city": "长沙",
      "type": "景点",
      "image": "https://images.unsplash.com/photo-1506905925346-21bda4d32df4?auto=format&fit=crop&w=1200&q=80",
      "description": "[]( []( []( [](\n\n赏花发票抽奖赏银杏春节全攻略赏红叶攻略五一旅游攻略教师节国庆旅游攻略考研除夕活动指南赏梅花个人养老金观日出攻略亲子游展会露营房贷利率婴幼儿照护电动车上牌中考一分一段表端午节养老金领取清明节云招聘免费景点人口。",
      "bestFor": [
        "观光",
        "拍照"
      ]
    },
    {
      "name": "太平街",
      "city": "长沙",
      "type": "景点",